,X,FilingDate,TradeDate,Ticker,InsiderName,Title,TradeType,Price,Qty,Owned,delta_Own,Value,1d,1w,1m,6m,ticker
0,D,2021-07-01 19:45:43,2021-06-29,ELEV,"Qiming U.S. Healthcare Fund Ii, L.P.",10%,P - Purchase,1600.0,312500,2370142,+15%,5000000.0,,,,,ELEV
1,D,2021-07-01 18:29:04,2021-06-29,ELEV,"Aisling Capital Iv, LP",10%,P - Purchase,1600.0,187500,2834910,+7%,3000000.0,,,,,ELEV
2,D,2021-07-01 17:27:53,2021-06-29,ELEV,"Venbio Global Strategic Fund Iii, L.P.",10%,P - Purchase,1600.0,625000,2608167,+32%,10000000.0,,,,,ELEV
3,D,2021-07-01 16:24:41,2021-06-29,ELEV,"Cormorant Asset Management, LP",Former 10% Owner,P - Purchase,1600.0,250000,2233168,+13%,4000000.0,,,,,ELEV
4,D,2021-06-29 16:07:21,2021-06-29,ELEV,Vertex Global Hc Fund II Pte. Ltd.,10%,P - Purchase,1600.0,250000,2307642,+12%,4000000.0,,,,,ELEV
